{
    "model_id": "FRAUD-DEV-021",
    "name": "Frequent Device Switching",
    "description": "Flags transactions where an entity frequently changes device fingerprints within a short time frame.",
    "threshold": 0.9,
    "evaluations": [
      {
        "name": "Recent_Devices_Count",
        "type": "aggregation",
        "aggregation": "COUNT",
        "field": "fingerprint",
        "conditions": [
          {
            "type": "comparison",
            "left": "transaction_date",
            "operator": ">=",
            "right": "datetime(now, '-1 hour')"
          }
        ],
        "weight": 4
      },
      {
        "name": "Device_Switch_Check",
        "type": "comparison",
        "left": "@Recent_Devices_Count",
        "operator": ">",
        "right": 3,
        "weight": 5
      }
    ],
    "actions": [
      {
        "type": "flag_transaction",
        "reason": "Frequent device switching detected within a short period."
      }
    ],
    "metadata": {
      "created_by": "Fraud Detection Team",
      "created_at": "2024-11-01",
      "last_updated": "2024-11-01",
      "notes": "Monitors for unusual device changes which may indicate compromised access or suspicious activity."
    }
  }
  