{
    "model_id": "R011",
    "name": "Unverified or High-Risk Beneficiary",
    "description": "Flags transactions to beneficiaries who are either unverified or marked as high risk due to unusual past activity.",
    "threshold": 0.9,
    "evaluations": [
      {
        "name": "Beneficiary_Verification_Check",
        "type": "comparison",
        "left": "transaction.beneficiary_id",
        "operator": "IN",
        "right": "destination.unverified",
        "weight": 5
      },
      {
        "name": "High_Risk_Beneficiary_Check",
        "type": "comparison",
        "left": "transaction.beneficiary_id",
        "operator": "IN",
        "right": "blacklist.beneficiaries",
        "weight": 4
      }
    ],
    "actions": [
      {
        "type": "flag_transaction",
        "reason": "Transaction directed to an unverified or high-risk beneficiary."
      }
    ]
  }
  